<?xml version="1.0" encoding="UTF-8"?>
<tns:events xmlns:tns="http://www.example.org/OneIdSchema" xmlns:xsi="http://www.w3.org/2001/XMLSchema-instance" xsi:schemaLocation="http://www.example.org/OneIdSchema event-schedule.xsd ">
  <tns:event>
    <tns:name>tns:name</tns:name>
    <tns:waitList/>
    <tns:booking/>
    <tns:attendance>
      <tns:name>
        <tns:name>tns:name</tns:name>
        <tns:booking/>
        <tns:waitList/>
        <tns:attendance/>
        <tns:person>
          <tns:name>tns:name</tns:name>
        </tns:person>
      </tns:name>
    </tns:attendance>
    <tns:eventFacilitator>
      <tns:person>
        <tns:name>tns:name</tns:name>
      </tns:person>
    </tns:eventFacilitator>
  </tns:event>
</tns:events>
